{
  "version": 1,
  "updatedAt": "2026-10-09T05:56:27.922304Z",
  "notes": "Curated for public display. Edit featured, reorder, or remove entries here. Keep raw exports in fan-reactions/source/.",
  "reactions": [
    {
      "id": "18104538059175602",
      "platform": "instagram",
      "username": "lynda.artofdreaming",
      "displayName": "Lynda | Alg\u00e9rienne \u00e0 Paris \ud83c\udde9\ud83c\uddff\ud83c\uddeb\ud83c\uddf7",
      "profileImageUrl": "avatars/lynda.artofdreaming.jpg",
      "commentText": "Traduction \ud83d\udc47 \u0642\u0627\u0644\u0648 \u0642\u0627\u0644\u0648\u0644\u064a \u0642\u0627\u0644\u0648 \u0642\u0627\u0644\u0648\u0644\u064a \u0642\u0627\u0644 \u0642\u0627\u0644 \u0642\u0627\u0644 \u0642\u0627\u0644\u0648 \u0627\u0644\u0646\u0627\u0633 \u0642\u0627\u0644\u0648\u0644\u064a \u0639\u0644\u064a\u0643 \u0647\u062f\u0631\u0648\u0644\u064a \u0636\u0631\u0628\u0648\u0646\u064a \u0642\u0637\u0639\u0648\u0646\u064a \u0631\u0628\u0637\u0648 \u0646\u062d\u0627\u0648 \u0642\u0637\u0639\u0648 \u064a\u0627\u0631\u0628\u064a \u0647\u0628\u0644\u0648\u0646\u064a",
      "postUrl": null,
      "createdAt": "2026-09-03T19:34:45.000Z",
      "featured": true
    },
    {
      "id": "18082045196695211",
      "platform": "instagram",
      "username": "_.gizemli._.kiz._",
      "displayName": "\u2728\ufe0fwitchy\ud83d\udda4\u2728\ufe0f",
      "profileImageUrl": "avatars/_.gizemli._.kiz._.jpg",
      "commentText": "A dizan win ikren kan adikhdem la chanson thura, tekhram uk la musique kabyle \ud83d\ude11",
      "postUrl": null,
      "createdAt": "2026-08-23T23:43:33.000Z",
      "featured": true
    },
    {
      "id": "17900415582560763",
      "platform": "instagram",
      "username": "jiji_juojuo_06",
      "displayName": "\ud80c\udd99\u2d63\ud835\udcf3\ud835\udcfe\ud835\udcf8\ud835\udcf3\ud835\udcfe\ud835\udcf8\u262f\u266a\u266c",
      "profileImageUrl": "avatars/jiji_juojuo_06.jpg",
      "commentText": "\ud83d\ude02\u2764\ufe0f",
      "postUrl": null,
      "createdAt": "2026-08-24T16:21:56.000Z",
      "featured": false
    },
    {
      "id": "18146416084553122",
      "platform": "instagram",
      "username": "kessikahina53gmail.com3",
      "displayName": "kessikahina53@gmail.com",
      "profileImageUrl": "avatars/kessikahina53gmail.com3.jpg",
      "commentText": "Bravo",
      "postUrl": null,
      "createdAt": "2026-08-30T19:06:41.000Z",
      "featured": false
    },
    {
      "id": "18261667528307200",
      "platform": "instagram",
      "username": "dr.sourires",
      "displayName": "DrSourires",
      "profileImageUrl": "avatars/dr.sourires.jpg",
      "commentText": "'@letacofficial tu connais ?.je vous verrai bien collabrer\ud83d\ude4c",
      "postUrl": null,
      "createdAt": "2026-08-23T18:29:54.000Z",
      "featured": true
    },
    {
      "id": "18005968367771408",
      "platform": "instagram",
      "username": "yacine_bal127",
      "displayName": "\u2d4d\u2d49\u2d31\u2d30\u2d54\u2d5c\u2d30",
      "profileImageUrl": "avatars/yacine_bal127.jpg",
      "commentText": "Ah je kiffe amigo @laousmail \ud83e\udee1\u2705",
      "postUrl": null,
      "createdAt": "2026-08-23T23:23:05.000Z",
      "featured": false
    },
    {
      "id": "18116438681476679",
      "platform": "instagram",
      "username": "lftlmjhwl1406",
      "displayName": "sweet girl",
      "profileImageUrl": "avatars/lftlmjhwl1406.jpg",
      "commentText": "Bravo wlh t3ejbiyi\ud83d\udd25\u2764\ufe0f",
      "postUrl": null,
      "createdAt": "2026-09-01T18:46:41.000Z",
      "featured": false
    },
    {
      "id": "18046044326606989",
      "platform": "instagram",
      "username": "romii_1519",
      "displayName": "romii_1519",
      "profileImageUrl": "avatars/romii_1519.jpg",
      "commentText": "\ud83d\ude02\ud83d\ude02",
      "postUrl": null,
      "createdAt": "2026-08-27T03:06:44.000Z",
      "featured": false
    },
    {
      "id": "18130516423727767",
      "platform": "instagram",
      "username": "tata37195",
      "displayName": "tata",
      "profileImageUrl": "avatars/tata37195.jpg",
      "commentText": "Et la voix c'est la classe\ud83d\ude0d\ud83d\udd25\u2764\ufe0f",
      "postUrl": null,
      "createdAt": "2026-08-23T19:01:42.000Z",
      "featured": false
    },
    {
      "id": "17955524823216953",
      "platform": "instagram",
      "username": "nanee__x10",
      "displayName": "\ud83e\udda2\ud83e\udd40",
      "profileImageUrl": "avatars/nanee__x10.jpg",
      "commentText": "Ja3la4 achoutt la langue agi alami isli4 imeden\ud83d\ude02\ud83d\ude02\ud83d\ude02\ud83d\ude02",
      "postUrl": null,
      "createdAt": "2026-08-24T11:06:57.000Z",
      "featured": true
    },
    {
      "id": "18091768196345607",
      "platform": "instagram",
      "username": "lina_lassouef",
      "displayName": "Lina \u1bd3\u2605",
      "profileImageUrl": "avatars/lina_lassouef.jpg",
      "commentText": "Belle chanson, kemmel\ud83d\ude0d",
      "postUrl": null,
      "createdAt": "2026-08-23T16:26:35.000Z",
      "featured": false
    },
    {
      "id": "17949298851265470",
      "platform": "instagram",
      "username": "emma_rima_487",
      "displayName": "\ud83c\udf38 Emma \ud83c\udf38\ud83e\ude77",
      "profileImageUrl": "avatars/emma_rima_487.jpg",
      "commentText": "Uthem3in arak akhali win i3edan diskhuzedh calma calma \ud83d\ude02\ud83e\udd0f\ud83c\udffb",
      "postUrl": null,
      "createdAt": "2026-08-24T21:00:30.000Z",
      "featured": true
    },
    {
      "id": "18206571847366469",
      "platform": "instagram",
      "username": "sha_ely1",
      "displayName": "sha_ely1",
      "profileImageUrl": "avatars/sha_ely1.jpg",
      "commentText": "\u0627\u0641\u0639\u0644\u0647\u0627 \u0627\u0641\u0639\u0644\u0647\u0627 \u0627\u0641\u0639\u0644\u0647\u0627 \u0627\u0641\u0639\u0644\u0647\u0627",
      "postUrl": null,
      "createdAt": "2026-08-24T00:51:01.000Z",
      "featured": false
    },
    {
      "id": "18115943021473576",
      "platform": "instagram",
      "username": "axiom_ani",
      "displayName": "\u2720 \u1d1c\u0280\u0274\u026a\u0274\u1d0f\u1d1c \u2720",
      "profileImageUrl": "avatars/axiom_ani.jpg",
      "commentText": "Ttughac nni xdmegh i toilette",
      "postUrl": null,
      "createdAt": "2026-08-29T06:21:22.000Z",
      "featured": false
    },
    {
      "id": "18114271171978989",
      "platform": "instagram",
      "username": "houda_boudghaghen",
      "displayName": "\ud83d\ude38\ud83d\ude38\ud83d\ude38\ud83d\ude38\ud83d\ude38",
      "profileImageUrl": "avatars/houda_boudghaghen.jpg",
      "commentText": "Welah dessa7\ud83d\ude02",
      "postUrl": null,
      "createdAt": "2026-08-23T23:27:05.000Z",
      "featured": false
    },
    {
      "id": "17915564934243471",
      "platform": "instagram",
      "username": "m_.ram_4",
      "displayName": "\ud83e\udee6\u2728",
      "profileImageUrl": "avatars/m_.ram_4.jpg",
      "commentText": "\ud83e\ude77\ud83d\ude42",
      "postUrl": null,
      "createdAt": "2026-08-27T21:55:10.000Z",
      "featured": false
    },
    {
      "id": "18118447165926993",
      "platform": "instagram",
      "username": "cabaneghania",
      "displayName": "cabaneghania",
      "profileImageUrl": "avatars/cabaneghania.jpg",
      "commentText": "\u0628\u0627\u0644\u062d\u0631\u0627\u0643\u0627\u062a \u062a\u0641\u0647\u0645 \u0648\u0627\u0634 \u0631\u0627\u0647\u0648 \u064a\u0642\u0648\u0644",
      "postUrl": null,
      "createdAt": "2026-08-24T12:32:58.000Z",
      "featured": false
    },
    {
      "id": "18612661894016610",
      "platform": "instagram",
      "username": "tima__dr",
      "displayName": "T\u00ee M\u00e2 \ud83d\udd4a\ufe0f",
      "profileImageUrl": "avatars/tima__dr.jpg",
      "commentText": "Achkitt\ud83d\ude02",
      "postUrl": null,
      "createdAt": "2026-08-23T22:28:57.000Z",
      "featured": false
    },
    {
      "id": "18129887980674681",
      "platform": "instagram",
      "username": "_tinhin_nane",
      "displayName": "_tinhin_nane",
      "profileImageUrl": "avatars/_tinhin_nane.jpg",
      "commentText": "Dizan wagi",
      "postUrl": null,
      "createdAt": "2026-09-01T22:59:46.000Z",
      "featured": false
    },
    {
      "id": "18111263486088954",
      "platform": "instagram",
      "username": "social_7home",
      "displayName": "Social\ud83c\udff7\ufe0f",
      "profileImageUrl": "avatars/social_7home.jpg",
      "commentText": "\u062d\u0633\u064a\u062a \u0634\u063a\u0644 \u064a\u0642\u0648\u0644 \u0646\u0627\u0633 \u062a\u0647\u062f\u0631 \u0639\u0644\u064a\u0627 \u0648\u0627\u0646\u0627 \u0645\u0634 \u0633\u0627\u0645\u0639 \u0628\u064a\u0647\u0645 \ud83d\ude02\ud83d\ude02\ud83d\ude02",
      "postUrl": null,
      "createdAt": "2026-08-24T13:13:41.000Z",
      "featured": true
    },
    {
      "id": "18004684502986516",
      "platform": "instagram",
      "username": "meelissa.amr",
      "displayName": "\ud835\udde0\ud835\uddf2\ud835\uddf9\ud835\uddf6\ud835\ude00\ud835\ude00\ud835\uddee \ud83c\udf3b",
      "profileImageUrl": "avatars/meelissa.amr.jpg",
      "commentText": "Bele3 dila3nayek tdhergem ukk la musique kabyle",
      "postUrl": null,
      "createdAt": "2026-08-24T17:12:47.000Z",
      "featured": false
    },
    {
      "id": "18049335119799044",
      "platform": "instagram",
      "username": "hamzaledjedel",
      "displayName": "\u0627\u0645\u064a\u0631\u0627 \u064a\u062a\u0648",
      "profileImageUrl": "avatars/hamzaledjedel.jpg",
      "commentText": "\u0627\u063a\u0646\u064a\u0629 \u0642\u0628\u0627\u064a\u0644\u064a\u0629",
      "postUrl": null,
      "createdAt": "2026-08-30T09:31:34.000Z",
      "featured": false
    },
    {
      "id": "17969431878136585",
      "platform": "instagram",
      "username": "mayas_amrn",
      "displayName": "M\u00c4X\u0178\u00c4S",
      "profileImageUrl": "avatars/mayas_amrn.jpg",